{"$schema":"https://json-schema.org/draft/2020-12/schema","$id":"https://github.com/gj3447/agent-coding-paradigm/spec/schema/m4a-contract.v1.schema.json","type":"object","additionalProperties":false,"required":["schema_version","status","purpose","public_api","owned_mechanism","invariants","states","rejection_codes","completion_boundary"],"properties":{"schema_version":{"const":"m4a-authority-contract/v1"},"status":{"const":"PROPOSED_PENDING_MEASUREMENT"},"purpose":{"type":"string","minLength":1},"public_api":{"const":"project_h_intent(command) -> HProjection | HRejection"},"owned_mechanism":{"type":"array","minItems":3,"items":{"type":"string"}},"invariants":{"type":"array","minItems":4,"items":{"type":"string"}},"states":{"type":"object"},"rejection_codes":{"type":"array","minItems":20,"uniqueItems":true,"items":{"type":"string"}},"completion_boundary":{"type":"string","minLength":1}}}
